mri and chest,mri and lung,mri and brain,mri and abdominal,mri and artery,mri and lobe,mri and liver,mri and abdomen
,,,,,contrast mri head axial section showing an irregularly enhancing mass in the right medial temporal lobe anteriorly in the close proximity to the cavernous sinus and oculomotor nerve (arrow).,,
,,mri of the brain showing no mass or enhancing lesion.,,,,,
,,,,,,,"mri of the abdomen. arrows indicate multiple, subcutaneous nodules enhanced by intravenous contrast agent"
,,brain mri: axial section (t2) showing optic nerve glioma.,,,,,
,,mri image of the brain in an axial view showing the “precontrast flair image”. note the abnormal lesions (circled) in the per ventricular area suggesting white matter pathology.,,,,,
,,mri of the brain; hemorrhagic infarction of the left temporal lobe,,,,,
,,,magnetic resonance imaging (mri) of the abdominal mass,,,,
,,,,,,,mri of the abdomen showing distended small and large bowel.
,,axial t2w mri of the brain shows symmetric areas of hyperintensity involving the splenium of the corpus callosum (arrow),,,,,
,,mri of brain with gadolinium showing overall decrease in midline shift and edema with no evidence of recurrence (arrow).,,,,,
,,"in a cranial mri performed in 2006, the flair sequence revealed no pathological lesions anywhere in the brain. in particular, the right-sided supramarginal gyrus, where the cavernoma would later develop, shows no evidence of any signal alteration.",,,,,
,,mri of the brain showing foci of calcification (arrows) in bilateral basal ganglia and subcortical regions of bilateral cerebral hemispheres,,,,,
,,"brain mri – a single uncharacteristic small focus in hemispheric white matter.abbreviation: mri, magnetic resonance imaging.",,,,,
,,"t2w axial mri of the brain shows multiple cystic lesions with hypointense eccentric nodules, in both cerebral hemispheres, the midbrain, the cerebellum, and the extraocular muscles",,,,,
,,t1 weighted mri of the brain obtained after administration of intravenous gadolinium demonstrating a ring enhancing metastasis in the posterior left parietal lobe.,,,,,
,,"32-year-old man with history of wilson's disease who presents with slurred speech. t2-weighed, axial mri image shows presence of hyperintensities involving dorsal midbrain.",,,,,
,,,,,cardiac mri with gadolinium enhancement demonstrating the presence of the anomalous pulmonary vein (white arrow) arising from the left apical posterior and anterior segments of the left upper lobe and connecting to the left brachiocephalic vein.,,
,,mri scans of the brain showing regression of pituitary mass,,,,,
,,mri of the brain with gadolinium: coronal t1w enhanced section showing the same findings with the mass in close proximity to the superior sagittal sinus. 135×135 mm (300×300 dpi).,,,,,
,,the brain mri at baseline represented a moderate t2 lesion load,,,,,
,,"mri brain t2 weighted (axial view) showing demyelination in cerebral white matter, corona radiate, centrum semiovale and bilateral internal capsules; subtle signal alteration detected in the middle cerebellar peduncles bilaterally.",,,,,
,,magnetic resonance imaging (mri) of the brain showing extensive inflammatory/infectious changes involving the intraconal and extraconal fat of the right and left orbits (black stars) concerning for orbital cellulitis. meningeal enhancement is also seen at the temporal regions concerning for meningitis (read arrows),,,,,
,,axial t1 postgadolinium enhanced brain mri with a visible pontine brain metastasis.,,,,,
,,,"36-year-old female presenting with pelvic mass, lower abdominal pain, infertility, and menorrhagia. follow-up mri post ufe shows the fibroids has completely regressed (arrow).",,,,
,,t1 - weighted axial mri - scan of the brain showing cortical atrophy and ex - vacuo dilatation of lateral ventricles,,,,,
,,"mri mucorales brain abscess: bilateral, predominantly frontal right lesion on t2-flair.",,,,,
,,"brain tumour. coloured 3d diffusion tensor imaging (dti) and magnetic resonance imaging (mri) scans of the brain of a 29-year-old with a low-grade glioma in the left frontal lobe. a dti scan shows the bundles of white matter nerve fibers and is being used here for presurgical planning. the fibers transmit nerve signals between brain regions and between the brain and the spinal cord. a glioma arises from glial cells; nervous system supports cells. dti scans show the diffusion of water along white matter fibers, allowing their orientations and the connections between brain regions to be mapped.",,,,,
,,mri brain showing oblitertion of transverse sinus in coronal section,,,,,
,,"axial t2w mri image of the brain reveals a large, well-defined mass lesion in left thalamic region, having heterogeneous hyperintense signal intensity",,,,,
,,brain mri was performed with evidence of intracerebral hematoma with right frontal brain edema.,,,,,
,,"brain fluid-attenuated inversion recovery mri sequence showing a hypointense, lobulated cystic lesion with internal septation and without a scolex in the left temporoparietal region, causing a mass effect.",,,,,
,,mri of brain showing ventriculomegaly.,,,,,
,,,,preoperative magnetic resonance imaging (mri) t2 sequenceshowing compression of the medulla by the vertebral artery,,,
,,,,,,,case 1—mri abdomen pelvis revealed 5.5 × 5.4 × 4.9 cm mass and biliary ductal dilatation from extrinsic compression (black arrow).
,,mri of the brain upon admission: axial flair image at the level of the occipital region showing symmetric high-signal intensity changes involving the cortical gray matter and the subcortical white matter of both occipital lobes. a prominent ventricular dilatation is also noted.,,,,,
,,mri brain (coronal section) showing empty sella,,,,,
,,axial brain mri in flair sequence showing abnormal signals in sigmoid sinus.,,,,,
,,brain mri t1-wi axial plane of a patient with ephedrone encephalopathy at midbrain level: increased signal intensity in cerebral peduncles.,,,,,
,,,,,mri axial flair with increased signal intensity at the medial temporal lobe (arrow).,,
,,,,,"a. t1 weighted mri scan, coronal section: a 3.5 × 2.0 cm mass is located in the superficial lobe of the right parotid gland. b. t1 weighted mri scan, axial section: an oval mass of about 1.0 cm in diameter is located in the left side of the nasopharynx.",,
,,"mri of the brain (sagittal view) shows a large right cerebellar ring-enhancing lesion indicated by the arrow.mri of the brain from the side (sagittal view) shows a large ring-enhancing mass in the cerebellum, which is seen as an irregular oval-appearing lesion with a bright white outline and is indicated by the arrow. mri - magnetic resonance imaging.",,,,,
,,,,reconstructed three-dimensional magnetic resonance imaging (mri) demonstrated positional relationships between right subclavian artery aneurysm and surrounding vessel.,,,
,,venous brain mri performed at second day with filling failure from left transverse sinus to ipsilateral jugular vein due to a cerebral venous sinus thrombosis.,,,,,
,,,,,"mri axial flair at time of second diagnosis of herpes simplex encephalitis with increased signal intensity in the medial temporal lobes, right greater than left.",,
,,,,,"mri demonstrating a mildly heterogeneous t2 hyperintense lesion in the right hepatic lobe, measuring approximately 4.4 cm × 4.8 cm × 4.9 cm.",,
,,brain mri (sagittal plane) showing normal size of the pituitary.,,,,,
,,magnetic resonance imaging (mri) of the brain showing pontine infarct (circle) and severe micrognathia (arrow).,,,,,
,,mri of the brain revealed prominent bilateral enhancing parietal-occipital lesions on flair and t2 sequences and small areas of hyperintensity in the left periventricular white matter on diffusion-weighted images.,,,,,
,,mri brain with contrast; t1 coronal sequence revealing a mass in the carotid spaces with cephalocaudad dimension of approximately 50–60 mm. the caudad margin of the mass begins approximately 15–20 mm superior to the carotid bifurcation. the mass extends cephalad through the jugular foramen and left aspect of the basilar cistern with erosion into the hypotympanum and mesotympanum.,,,,,
,,,intra-abdominal testes detected by mri. t= testis,,,,
,,t1 ax flair (brain mri with and without contrast). red arrow indicating debris layering in the left ventricle.,,,,,
,,,,,,mri image of an arterially enhanced lesion representing hepatocellular carcinoma seen with washout and delayed capsular enhancement. the tumor measures 2.2 cm in diameter and is located on segment 7 of the liver in close proximity to the tendinous portion of the right hemidiaphragm.,
,,,"mri imagining shows tumor (omega arrow), herniated descending colon (alpha arrow), and abdominal wall defect (dotted beta arrow).",,,,
,,,,,,,mri of the lower abdomen and pelvis (coronal fat-suppressed image) shows an ectopic pelvic location of the kidney (arrow). the prostate gland is not visualized
,,,,,mri flair of a patient with limbic encephalitis and positive nmdar antibodies in the csf. increased signal intensity is seen in the bilateral medial temporal lobes and hippocampi.,,
,,,,,,,magnetic resonance imaging (mri) of the abdomen revealing a solid mass 20 cm of maximum diameter.
,,,cross-sectional abdominal mri showing concomitant cirrhotic liver with multiple ill-defined heterogeneous lesions.,,,,
,,"preoperative head mri (blue arrow - orbital cellulitis, red arrow - sinusitis, yellow arrow - brain abscess)",,,,,
,,mri brain after administration of mdc nuanced impregnation of the meninges in the cerebellar lobe in some places shows micro nodular appearance (case 4),,,,,
,,mri brain with contrast; t1 coronal sequence demonstrating a mass close to the external auditory canal with diffuse minimal somewhat heterogeneous enhancement.,,,,,
,mri image of a metastatic brain tumor from lung cancer in the deep right parietal lobe. has been reproduced.11,,,,,,
,,brain mri changes in a 4-year-old boy with propionic academia,,,,,
,,,abdominal mri following two sessions of open surgery and radiofrequency ablation for a left-sided recurrent solid mass. there is no sign of recurrent or residual solid tumor in the kidneys. remnant adrenal tissue on the left side was free of any recurrent lesion and was measuring 24.62 × 9.48 mm in diameter. multiple cysts are visible in the right kidney.,,,,
,,"brain mri of gp bilateral lesion of the occipital cortex, slightly greater on the right side, with involvement of the adjacent parietal lobes.",,,,,
,,mri image of the brain in an axial view showing the “post-contrast flair image”. note the abnormal lesions (circled) in the per ventricular area do not show any enhancement with contrast injection.,,,,,
,,axial susceptibility weighted image of mri brain with an arrow indicating the extra-axial collection in right frontotemporal region.,,,,,
,,"t2 weighted mri brain – left carotid cavernous fistula, most likely direct (type a) with enlarged drainage vessels which included the left superior ophthalmic, left sphenoparietal and inferior petrosal sinuses.",,,,,
,,the coronal view of brain mri with bilateral signal intensity in both thalamus,,,,,
,,a coronal contrast-enhanced mri of the brain demonstrating the heterogeneously enhancing left temporal lobe mass (glioblastoma multiforme) with an associated cystic component (arrow).,,,,,
,,,,,,,coronal mri of the abdomen showing split of the spinal vertebrae below the dorsolumbar junction.
,,abnormal signal in bilateral basal ganglia and brain atrophy in an mri from a 4-year-old boy with propionic-acidemia,,,,,
,,"skull mri with craniofacial disproportion, increased subarachnoid space, and corpus callosum hypoplasia. the brainstem, cerebellum, and spinal cord are preserved",,,,,
,,t1 post-contrast axial mri image of brain showing marrow signal abnormality within the clivus with an expansile mass with soft tissue component in the cavernous sinus and right cerebellar metastasis.,,,,,
,,"swi 7t mri of the midbrain and the surrounding structures.csf: cerebrospinal fluid, pu: putamen, sn: substantia nigra, nr: nucleus ruber, n1: nigrosome 1.",,,,,
,,mri brain scan performed 9 months post chemotherapy. the follow-up scan indicates that the previously noted oedema and the majority of the cns lesions have resolved.,,,,,
,,axial mri of the brain showed brain metastasis. the maximum size of the brain metastasis was a tumor in the left lobe measuring 10 mm in diameter with surrounding cerebral edema.,,,,,
,,,,,axial t1 weighted gadolinium enhanced mri scan showing gadolinium-enhanced nodular lesion in the left temporal lobe.,,
,,,,,"mri scan (sagittal view) was suggestive of sphenoid wing dysplasia on right side with herniation of right fronto-temporal lobe, temporal horn of right ventricle and csf through the defect. hemiatrophy of right cerebral hemisphere",,
,,,examples of breast findings by bi-rads category. a 49-year-woman underwent abdominal mri for liver evaluation. three-dimensional dynamic axial volumetric interpolated breath-hold examination image after intravenous power injection of 0.025 mmol/kg of gadoxetic acid (primovist) at 60 s. less than 50 % of the breast tissue was visible at abdominal mri. an oval nodule (white circle) was found in the inner quadrant of the right breast (20 mm). the breast finding was first categorized as bi-rads rm 3. after electronic medical record review this finding was downgraded as bi-rads rm 2 (known fibrolipoma). in the upper right corner is highlighted the breast findings (white arrow),,,,
,,,,,infarct region compatible with large-size mca infarct in left frontotemporoparietal lobes on cerebral mri.,,
,,,the magnetic resonance imagery (mri) t1 of the pelvis showed bone oedema of symphysis pubis and abdominal muscles after gadolinium injection,,,,
,,brain mri axial fluid attenuated inversion recovery (flair) image shows the characteristic periventricular areas of increased signal intensity (arrows) that are oriented perpendicular to and often contiguous with the lateral ventricles.,,,,,
,,brain diffusion-weighted mri shows small high signal lesions (arrow) in right occipital lobe.,,,,,
,,,,,"rhabdoid tumour. axial t1w mri post-gadolinium enhancement showing a large heterogenous left renal mass with a hypointense metastasis in the right lobe of the liver, due to metastatic rhabdoid tumour in an infant. this is usually a very aggressive neoplasm.",,
,,brain mri of the index patient showing pnh.,,,,,
,,,abdominal mri showing cbd stones.,,,,
,,,,,,,"t2w spair sagittal mri of lower abdomen demonstrating the placental invasion. placenta (a), invasion area (b), sigmoid colon (c), uterine cavity (d)."
,,,,"axial 3d time of flight mri of the head, noting the unusual origin of the left internal carotid artery (arrow) from the contralateral cavernous segment of the right internal carotid artery. note the course of the left internal carotid artery through the floor of the sella turcica.",,,
,,,,,,"mri scan showing abnormal areas in segments two, three, and four of the liver.",
,,mri of the brain displaying left frontoparietal dominant extracranial soft tissue lesion.,,,,,
,,axial diffusion-weighted imaging (dwi) magnetic resonance imaging (mri) shows restricted diffusion in midbrain,,,,,
,,"post‐gammaknife mri‐brain and cavernous sinus/orbital apex. axial t2 precontrast slice, white‐dashed arrow identifies residual right cavernous sinus disease. solid white arrow identifies right temporal lobe mass.",,,,,
,,"mri brain with gadolinium contrast; fast spin-echo fat-suppressed t2 axial sequence demonstrating a lesion at the skull base, at jugular foramen level, dimensions approximately 26×14 mm.",,,,,
,,brain mri - increased signal in flair images in the withe matter territories adjacent to the lateral ventricles bodies and subcortical zone,,,,,
,,,"snr on mri.snr was determined, where si (signal intensity) is the average signal strength of the abdominal aorta wall, and sd is the standard deviation of the signal intensity in the background of the scan.",,,,
,,,,22-year-old female with uterine artery pseudoaneurysm. mri 3d mip gradient image demonstrating the pseudoaneurysm in the left aspect of the uterus myometrium (white arrow).,,,
,,molar tooth sign.transverse t1wi of mri demonstrates appearance resembling molar tooth with horizontal tubular structure originating from midbrain on both sides of midline (arrows). this was patient with joubert syndrome.,,,,,
,,regression of tumormri of the brain showing decrease in size of patient’s hemangioblastoma at last follow-up.,,,,,
,,"in the left parasagital-frontoparietal convexity of brain mri, a small meningioma (2.1 × 2.0 × 1.4 cm) was newly detected.",,,,,
,,,pelvic-abdominal mri showing the transplanted kidney in the right iliac fossa.,,,,
,,mri aspect with left brain hemisphere subdural haematoma in patient m.f. of 41 years old (45 days after the initial discharge from hospital),,,,,
,,brain mri axial t2wi without gad showing left mastoid air cell opacification and involvement of the left petrous apex,,,,,
,,"mri brain showed t2/flair signal hyperintensity over the bilateral posterior head regions, consistent with pres",,,,,
,,,,,mri of the abdomen (post contrast) showing multiple nodules in both lobes of the liver with faint central enhancement (arrow).,,
,,an 11-month-old female patient with gm2-gangliosidosis with bilateral thalamic involvement int2 sequence of the brain mri,,,,,
,,,,case 2: occlusion of the right internal carotid and middle cerebral artery marked with an arrow (mri),,,
,,mri brain t1w image showing hypointensity in the splenium of corpus callosum (white arrow),,,,,
,,sagittal gd-enhanced brain mri after 5-course chemotherapy shows complete disappearance of the tumor.,,,,,
,,the brain mri shows residual hematoma in the right basal ganglia and an additional mass lesion in the splenium portion of the right corpus callosum.,,,,,
,,"mri of the brain. dwi shows no restricted diffusion at the left medulla which correlates to increased diffusion in adc.abbreviations: adc, apparent diffusion coefficient; dwi, diffusion-weighted imaging; mri, magnetic resonance imaging.",,,,,
,,diffusion-weighted images mri brain: areas of restricted diffusion in the region of the brain stem,,,,,
,,"sagital mri t1 weighted image of the brain and sella showing features of increased intracranial pressure in a 7-year-old boy, partial empty sella syndrome.",,,,,
,,sagittal section of the mri brain demonstrating the pituitary mass.,,,,,
,,,,,,,mri of the abdomen demonstrates an enlarged 2.0 cm left para-aortic lymph node with enhancement after gadolinium (red arrow).
,,mri brain (coronal section) showing right sided temporopareital infarction,,,,,
,,mri of the brain showing abnormal gadolinium enhancement in the swollen left oculomotor nerve (solid arrow). the right oculomotor nerve is indicated by a dotted arrow.,,,,,
,,axial flair mri brain showing left temporal gyral hyper intensities (arrow) in addition to arachnoid cyst,,,,,
,,brain mri of patient aiv-5 showing cerebellar atrophy.,,,,,
,,mri brain t2wi (axial view) showing isointense to hypo intense lesion in the left frontal lobe,,,,,
,,mri of the brain demonstrating left parieto-occipital subcortical t2 hypointensity on fluid-attenuated inversion recovery.,,,,,
,,t2w mri brain showing an area of demyelination at the junction of right middle cerebellar peduncle and pons,,,,,
,,,sagittal view of abdominal mri. tumor (arrow) extends from the superior pole of the right kidney to the right atrium.,,,,
,,,,,,,"mri showing urinary bladder, foetal head, lower portion of hydronephrotic left kidney occupying lower abdomen and pelvis."
,,mri of the brain with and without contrast displayed left frontal lobe infarction (red arrow).,,,,,
,,mri brain: large right frontal lobe mass.,,,,,
,,,,"augmented fluoroscopy. three-dimensional whole heart mr images are fused with angiographic images to augment procedural guidance. in this case, the left pulmonary artery in a child with a fontan circuit has been stented. the optimal angulation for imaging is predetermined using the mr dataset. blue ring markers on the mri dataset are used to guide the positioning of the stent. the images show good registration on the angiogram after stenting has taken place.",,,
,,"mri of the brain (coronal view) shows a right cerebellar ring-enhancing lesion.mri of the brain from a vertical, frontal plan (coronal view) showing a large (25.3 mm diameter) ring-enhancing lesion in the patient's cerebellum, which is indicated by the arrow. mri - magnetic resonance imaging.",,,,,
,,mri brain showing hyperintensity in the right optic nerve head,,,,,
,,,,,,mri performed 4 weeks after initial ct also demonstrates resolution of infarcts in the liver and resolving infarcts in the spleen.,
,,,,,,,sagittal view t1 weighted mri abdomen/pelvis.
,,"field of view (fov).the field of view used for fmri acquisition during task performance, indicated as a blue translucent square overlaid on a sagittal slice through the anatomical scan of one of the participants. care was taken that the striatum, midbrain, fef and sef were in the field of view. in between functional runs, the angulation was checked regularly and adjusted if required.",,,,,
,,,,,"mri head and neck coronal cut, after contrast, t2: a well-defined, t2 intermediate si solid lesion in the left superficial parotid lobe. there is diffuse intense enhancement. multiple enlarged lymph nodes in the left periparotid region.",,
,,mri of brain t1 axial + gadolinium showing small tuberculoma in the right prepontine cistern before anti-tb treatment.,,,,,
,,brain mri. mri scan of the brain showing two closely related cerebral abscesses in the left occipital region and resulting peri-lesional edema and the mid-line shift,,,,,
,,brain mri with bilateral peripherally enhancing white matter lesions representing signs of active demyelination.,,,,,
,,electrode reconstruction from co-registered ct data one day after surgery (red) and one year later (blue). co-registered t1 mri displayed in background. note the non-linear bending of the trajectories due to brain shift respectively inverse brain shift.,,,,,
,"75-year-old male patient, displaying dm with bilateral lung ild, bilateral femoral head necrosis.follow-up wbmri showed patchy, reticulonodular and ground glass opacities in bilateral lungs; the most pronounced in the lower right lobe (white arrow). both femoral heads showed the osteonecrosis area (white arrow) surrounded by curving high signal.",,,,,,
,,brain magnetic resonance imaging (mri) revealing left side cerebellar abscesses.,,,,,
,,,,dwi mri showing the typical heart-shaped appearance of bilateral medial medullary infarcts. there is also a small infarct in the left posterior inferior cerebellar artery territory,,,
,,,,,"herpes encephalitis, mri section shows bilateral hyperdense lesions in the temporal and parietal lobes.",,
,,mri brain (gre t2wi) showing multiple hypointense lesions diagnosed as cerebral cavernomas.,,,,,
,,"a 24 year old male presented with acute onset headache with drowsiness in the background of recent fever. on examination he had pupil sparing ptosis, vertical gaze paresis, mild sensory neural deafness and bilateral subtle pyramidal signs. mri brain showed symmetric hyperintense lesions in the caudate nuclei and putamina extending into the thalami and periaqueductal regions, on t2w images (figure 6). his serum and csf lactic acid levels were raised.a quadriceps mucle biopsy revealed subsarcoplasmic accumuilation of mitochondria) associated with cytochrome oxidase negative fibres. no mitochondrial mutations were detected. following intravenous thiamine therapy he recovered rapidly",,,,,
,,,,,"mri scan obtained november 2012. axial t1 image showed multiple small peripheral airspace opacities in the right lower lobe (yellow arrow), which was compatible with alveolar hemorrhage given the patient’s history and clinical presentation.",,
,,,,,,t2 weighted mri showing multiple hyperinetense cysts in liver and both kidneys,
,,"brain mri sagittal section in t1, showing mild cerebellar atrophy in a patient with ctx.",,,,,
,,,the figure shows mri image of giant pelvic mass filling whole abdominal cavity with heterogenous and semisolid appearance (corresponding the image between four white callipers).,,,,
,,,"abdominal mri showing a well-defined encapsulated mass, in the left paraspinal region at the l5 level along the posterior side of left psoas muscle.",,,,
,,mri brain showing infarcts in bilateral heschl gyri.,,,,,
,,mri of the brain. mri was performed on patient 1 at 12 years of age. t1w1 sagittal image demonstrates prominent cerebellar atrophy involving superior and middle cerebellar folia. axial images (not shown) revealed normal subcortical and cerebellar white matter. mr spectroscopy was normal (not shown). repeat mri imaging at 16 years old was unchanged (not shown). mri of the brain (patient 2) showed a similar pattern but milder cerebellar atrophy (not shown).,,,,,
,,diffusion-weighted image of the brain mri taken on day 9 with high intensity areas on the left middle cerebral artery region.,,,,,
,,"sagittal mri view of the brain at the age of 17 showing diffuse increased t2 signal in the subcortical and periventricular white matter demonstrating diffuse leukodystrophy. ge sagittal t2 cube image performed on a 3t mr ge scanner with tr: 3000, te: 69.1.",,,,,
,,,"abdominal magnetic resonance imaging (mri) shows a pancreas head only, with nonvisualization of the body and tail.",,,,
,,,,,mri of the cervical region showing the right thyroid lobe with a nodular structure and right cervical lymph nodes highly suspicious for malignancy,,
,,postoperative brain mri shows the bilateral vas transposed from the brainstem.,,,,,
