mri and chest,mri and lung,mri and brain,mri and abdominal,mri and artery,mri and lobe,mri and liver,mri and abdomen
,,"32-year-old man with history of wilson's disease who presents with slurred speech. fluid-attenuated inversion recovery sequence, axial mri image shows presence of hyperintensities involving dorsal midbrain.",,,,,
,,,"stimulated ovary without torsion diagnosed as torsion by mri. axial t2 weighted mr image of the pelvis in a 31-year-old woman with abdominal pain and leukocytosis at 5 weeks 6 days gestational age demonstrates marked asymmetric enlargement of the right ovary (arrow) with increased right ovarian stromal signal intensity. prospective and retrospective mri diagnosis was ovarian torsion, but further history (not available at the time of image interpretation) revealed known asymmetric enlargement of the right ovary since the time of egg retrieval",,,,
,,brain mri shows symmetrical normal-sized hippocampi.,,,,,
,,brain mri abnormalities in an anti-mog antibody-positive patient. axial t2-flair (fluid-attenuated inversion recovery) brain mri of a mog-seropositive nmo patient 31 years after disease manifestation with combined optic neuritis and transverse myelitis showed multiple abnormalities fulfilling barkhof criteria and resembling multiple sclerosis lesions.,,,,,
,,"mri brain on hospital day 36, with punctate enhancing lesions and one notable ring-enhancing lesion (t1 post contrast).",,,,,
,,initial brain mri t1-wi axial plane of a patient with ephedrone encephalopathy: symmetrically high intensity signal in globi pallidi (globus pallidus to frontal lobe white matter signal intensity ratio is ca. 152%).,,,,,
,,brain mri showed enhancement in bilateral hippocampus.,,,,,
,,pre-operative mri brain (p+c) of 32 m having left sided giant vestibular schwannomas (hannover stage 4b),,,,,
,,,,,,,"post-transplant mri of abdomen demonstrates patent ovarian (blue arrow) and renal vein (yellow arrow). note the ovarian vein dilation to compensate for the increase in renal blood flow. (for interpretation of the references to colour in this figure legend, the reader is referred to the web version of this article.)"
,,mri brain plain. arrows show hemiatrophy and reduction in the volume of brain parenchyma and thinning of grey matter,,,,,
,,mri brain showing hypoplastic pituitary with visible stalk and absent splenium of corpus callosum,,,,,
,,brain mri flair bilateral parieto-occipital hyperintese lesions.,,,,,
,,"t1 w mri of brain, axial images showing solid cystic lesion, solid component being iso to hyper intense",,,,,
,,axial mri of the brain showing diffuse lesions mimicking secondary tumours.,,,,,
,,mri brain showing increased t2 flair signal in brainstem.,,,,,
,,"mri brain flair image axial view showing round shaped mass in the third ventricle, with enlarged both lateral ventricles shown by white arrows.",,,,,
,,,,,,mri image detailing a 6.6 × 5 cm cystic mass originating from segment 4b of the liver (arrow).,
,,mri of the brain with region of restricted diffusion consistent with infarct in the territory of the left middle cerebral artery.,,,,,
,,,"mri of the abdomen and pelvis showing 4 fluid collections, the largest of which is 4 cm in diameter. the most superficial abscess is eroding into the fascial planes of the peritoneum with associated soft tissue edema of abdominal wall.",,,,
,,"mri brain, day 5 in icu",,,,,
,,brain mri of patient 2. flair images of the brain of patient 2 showing multiple periventricular cystic lesions in addition to attenuated signal in the subcortical white matter,,,,,
,,,,,"mri t2 flair image demonstrating findings of posterior reversible encephalopathy syndrome involving bilateral parietal-occipital lobes, left greater than right (arrows).",,
,,"the mri of the brain showing a cortical-based mass lesion at the medial aspect of the right temporal lobe, involving the amygdala and part of the head of the hippocampus",,,,,
,,,,dynamic contrast enhanced mri of the artery phase showed a small defect in the left portal vein (arrow).,,,
,,,,,"mri of the cranium revealed infarct areas of posterior limb of capsula interna, right globus pallidus, left occipital lobe and bilateral thalamus.",,
,,,,,mri: the caudate lobe showed compensatory hypertrophy after operation.,,
,,mri of the brain showing multiple lesions consistent with fat embolism.,,,,,
,,"brain mri, axial view with contrast enhancement",,,,,
,,,,left anterior inferior cerebellar artery hyperplasia and cochlear artery hyperplasia (selective angiography mri).,,,
,,,,,magnetic resonance imaging (mri) showing solitary metastasis in the left frontal lobe,,
,,brain magnetic resonance image (mri) showing the decrease in size of the left hippocampus with loss of gray-white differentiation. this observation is consistent with mesial temporal sclerosis.,,,,,
,,"t1 mri imaging showing clival lesion, osseous destruction and brain stem displacement",,,,,
,,,,,axial t2-wi mri scan demonstrating congenital vascular malformation in the left temporal lobe.,,
,,axial fluid attenuation inversion recovery (flair) mri of the brain showing a bright signal from the medial temporal lobe on the left side (arrow) consistent with limbic encephalitis.,,,,,
,,"brain abscess due to actinomyces meyeri in patient 28. brain mri t1 sequence showing a 3 cm tumefaction in the right posterior temporal region, with annular homogeneous contrast enhancement and peripheral edema. mri = magnetic resonance imaging.",,,,,
,,,,,mri scan after rfa. the tumour involves the vena cava and middle hepatic veins. the right hepatic vein is not seen. the right lobe of the liver shows atrophy and the left lateral lobe hypertrophy.,,
,,diffusion mri brain without contrast showing multiple infarctions within the cerebellar hemispheres (see arrows).,,,,,
,,,,,,mri of the liver showing lesion at the confluence of right and left hepatic ducts with extension in to the left duct.,
,,t2 weighed sagittal secion of brain mri of patient i1 family 11: t2 hyperintense spot is present in the frontal white matter (arrow).,,,,,
,,hemangioblastoma after attempted surgical resectionrepeat mri of the brain after attempted surgical resection showing no significant change in the size of the tumor or associated brainstem compression.,,,,,
,,mri of the brain: vertical view 3 months after treatment showing improvement with partial resolution of sagittal sinus thrombosis.,,,,,
,,,,,"t2 sagittal mri through a right paracentral position showing multiple subcortical white matter lesions in the right temporal lobe anteriorly, and the right occipital lobe posteriorly.",,
,,mri brain (t2w) coronal images showing bilateral cerebellar and occipital infarct,,,,,
,,,,mri angiogram of the popliteal fossa showing complete occlusion of the popliteal artery in the left leg.,,,
,,coronal flair brain mri image. image reveals bilateral hippocampal reduction predominantly to the left.,,,,,
,,"brain mri with and without contrast, sagittal view. the arrow indicates t1 post gadolinium sequences also demonstrating questionable vague enhancement in the same area, extending in a linear fashion towards the central canal.",,,,,
,,,,,flair mri demonstrating bilateral contrast hyperintensity in the medial temporal lobes in a 44 year old male with anti-nmda receptor encephalitis.,,
,,,,,,,axial t2 mri image of the abdomen. the bar represents the 9.5 mm mass in the neck of the pancreas
,,"blood vessels in the rabbit brain that were visualized by time-of-flight magnetic resonance angiography during our mri studies and analysis of vessel diameters focused on the left and right common carotid arteries, the basilar artery, the left and right internal carotids arteries, and the left and right posterior communicating arteries.",,,,,
,,,,,mri of the head showing ring enhanced lesion in the right temporal lobe with surrounding edema at the time of diagnosis,,
,,"the mri of the brain showing a hypointense mass lesion on t1, hyperintense on t2, giving a ‘bubbly’ appearance, and a mixed signal, with a bright rim in the fluid attenuated inversion recovery images",,,,,
,,brain mri axial t1wi without gad showing left mastoid air cell opacification and involvement of the left petrous apex,,,,,
,,diffusion weighted imaging brain mri. pronounced high signal intensity in the center of the lesion corresponding to restricted diffusion of water molecules. imaging findings are most compatible with cerebral abscess.,,,,,
,,mri brain on admission.,,,,,
,,"mri brain, saggital view. note the hyperintensity extending from the frontal sinus to the abscess cavity",,,,,
,,mri of the brain: horizontal view 3 months after treatment showing improvement of transverse and sigmoid sinus thrombosis.,,,,,
,,mri examination of the brain. axial flair t2 at day 5 after completing ivig,,,,,
,,,,,mri t2 flair sequence (coronal section) shows a small focus of low signal intensity in the cortex of the right posterior parietal lobe measuring 5.2 mm in diameter. mr imaging was performed at 1.5 t [repetition time (tr)/echo time (te): 8002/126].,,
,,mri t2w image of brain showing a csf intensity cystic lesion in right temporoparietal region,,,,,
,,"mri brain, age 56 days. axial section showing small dysplastic vermis, large rounded superior cerebellar peduncles and absence of decussation of white matter pathways forming the ‘molar tooth’ malformation",,,,,
,,mri brain scan.,,,,,
,,mri brain revealing a large 7.1×3.8 cm fairly homogeneous enhancing relatively well-defined mass centered in the posterior calvarium with intracranial extension into the extra-axial space as well as extracranial extension. the mass abuts the superior sagittal sinus. there is a similar appearing 3.7×4.5 cm fairly homogeneous relatively well-defined enhancing mass centered in the left anterior lateral calvarium also extending into the extra-axial space as well as extracranially.,,,,,
,,brain mri t2-wi axial plane of a patient with ephedrone encephalopathy: symmetrically low intensity signal in globi pallidi.,,,,,
,,,,,mri of a child with optic neuritis showing multiple t2 hyperintense lesions involving parietooccipital lobe,,
,,,,,,mri abdomen with 11 mm nonspecific t2 hyperintense lesion in the posterior dome of the liver (arrow). hepatosplenomegaly with smooth liver edges measuring 23 cm superior to inferior and the spleen 12.5 cm near the upper limit of normal. no changes suggestive of cirrhosis or fatty infiltration.,
,,"t1w sagittal mri of a five year old chihuahua without sm with a framework of 19 measurements (11 lines and 8 angles) with three ratios used to ‘map’ the hindbrain and craniocervical junction.key: (a) dorsum of spheno-occipital synchondrosis. (b) basion of basioccipital bone. (c) rostral edge of the dorsal lamina of the atlas. (d) junction between the supraoccipital bone and the occipital crest. (e) most dorsal point of intersection of the cerebellum with the occipital lobe circle. (f) centre of’ best fit’ occipital lobe circle placed on the cranial baseline (abi) and extending to encompass the occipital lobes. the centre of the circle is f and its diameter (f-diam) indicates the maximun height of the caudal calvaria dorsal to the spheno-occipital synchondrosis. (g) point at which the optic nerve deviates into the optic canal. (i) intersection point of the extended cranial baseline (ab) caudally with extended line dc ventrally to form angle 3. this indicates the relative positions of the supra and basioccipital bones to the atlas. (j) most rostral aspect of the dens of the axis bone. (k) extended line from point b along the best fit line of the ventral medulla oblongata to where it changes angle to the spinal cord (degree of medullary kinking). 8 angles measured are (1) afg, (2) fac, (3) dib, (4) jcb (5) aeb (6) ebd (7) bdi (8) dbk. * trait used in previous gb study [9].",,,,,
,,,,,,"magnetic resonance scan of upper abdomen with and without contrast. this is a representative slice from the mri performed during the initial patient hospitalization with the following details. procedure date: february 24, 2013. findings: there is a nonenhancing complex cystic lesion in segment 8 of the liver, which contains numerous serpiginous internal septations, small foci of fat and fluid. no additional lesions identified. there is no evidence of intra or extra biliary ductal dilation. the gall bladder is normal. the pancreas, adrenals, and kidneys and spleen are unremarkable. no contrast extravasation into the cyst is seen on the hepatocyte phase images. there is no mesenteric or retroperitoneal lymphadenopathy. the visualized bowel is unremarkable. impression: cystic liver lesion containing small foci of fat is most likely an echinococcal cyst.",
,,brain magnetic resonance imaging (mri) showing long t2 signal in the saddle area in a 45-year-old man hospitalized due to headache and vision disorder.,,,,,
,,"brain mri (t2 flair) presented a large geographic cerebromalatic change in left parietal lobe. mri, magnetic resonance imaging.",,,,,
,,diffusion-weighted mri of the brain of the second patient showing hyperintensities in the bilateral occipital lobe,,,,,
,,,,"dwi mri sequence completed once the patient presented with delayed ischemic symptoms. there is evidence of restricted diffusion in dwi with hyperintensity in the adc map (not shown) in the same left middle cerebral artery vascular territory, indicating early subacute infarction.",,,
,,,,,,,initial mri before start of therapy demonstrating a large tumor of the upper left abdomen infiltrating the mesenterium and the omentum majus.
,,"mri brain of case 1, t2 axial, arrow denotes pontine cleft (split pons sign) (c) mri spine of case 1, t2 coronal",,,,,
,,"brain mri of the patient (2 months after onset) shows massive brainstem hemorrhage involving area from midbrain, pons to cerebellum in axial t2 weighted flair image.",,,,,
,,,,,,,mri scan of abdomen obtained on the 12th day of disease: edematous jejunal wall and distension with air fluid level in caecum (arrows).
,,a head mri at 5 months after starting crizotinib showed a left orbital metastasis with multiple brain metastases.,,,,,
,,close up image of t2wi mri brain image of multiple periventricular hyperintense lesions.,,,,,
,,mri brain-axial t2 flair showing left frontal lesion.,,,,,
,,mri of the brain showing pituitary macroadenoma compressing the optic chiasm.,,,,,
,,,,,,,mucinous cystic neoplasm (arrow) on mri abdomen.
,,,,,primar neuroradiological mri: blotchy melted lesions of high shadow intensity in parietal and occipital lobes,,
,,,"abdominal mri, the left renal mass is evident.",,,,
,,,,,,mri showing caudal lesion of undifferentiated embryonal sarcoma of the liver mri: magnetic resonance imagingthe caudal lesion of undifferentiated embryonal sarcoma of the liver has been highlighted by the arrows.,
,,,the magnetic resonance imagery (mri) t1 of the pelvis showed bone oedema of symphysis pubis and abdominal muscles,,,,
,,mri of the brain revealed no masses which generally ruled out brain involvement (neurocysticercosis),,,,,
,,,,mri of the right hand showing a pseudosarcomatous mass encircling the ulnar artery.,,,
,,brain mri after completion of 2nd line chemotherapy.,,,,,
,,mri of brain showing pituitary tumour,,,,,
,,mri image of patient ii. it indicates mild cerebellar atrophy in an axial image of brain mri,,,,,
,,"brain mri, t2 sequence: multiple cortical and subcortical infracts in a vascular dementia patient",,,,,
,,an mri of the brain (t2 weighted images) showing right sided brain atrophy.,,,,,
,,,,,,,"mri abdomen, arrow indicating complex ovarian mass."
,,,,,,,magnetic resonance imaging (mri) scan of the abdomen demonstrating a lesion of the pancreatic tail (arrow) with associated calcifications of the lesion's wall and a central cystic component.
,,"mri brain when patient presented with symptoms: t1 sagittal sequence of brain mri show reduced mammillary body and pontine distance due to the descent of the mammillary body (arrow), crowding of posterior fossa due to brainstem descent, descent of cerebellar tonsils, sagging of tuber cinereum, inferior displacement of splenium and descent of the fastigium of the fourth ventricle",,,,,
,,"mri brain. axial t2 image showing multiple white matter lesions, especially in the corpus callosum. the arrows point to only two of several callosal lesions. early in the disease, callosal lesions are usually best seen on thin section sagittal flair and sagittal t1 images, with contrast.",,,,,
,,postoperative mri t1brain showed decompression of ventricles with presence of cm1,,,,,
,,mri brain,,,,,
,,mri scan of brain recorded on the 12th day of disease: bilateral hyperintensity in lateral thalamic regions (arrows).,,,,,
,,,,,,,mri of abdomen and pelvis demonstrating presence of a large polyploid mass at the interface of the neobladder and urethral structure.
,,,,,"transverse t2 weighted (t2w) mri section showing hyperintensity and marked heterogeneity of signal in a left frontal lobe oligodendroglioma. note extension of the lesion through the corpus callosum to the right frontal lobe (arrow), creating a “butterfly glioma” appearance.",,
,,,,,"mri t2 flair sequence (coronal section) performed during pregnancy, showing the small focus of calcification in the right parietal lobe with moderate surrounding edema. mr imaging performed at 1.5 t (tr/te: 8000/130).",,
,,,lateral abdominal magnetic resonance (mri) image.,,,,
,,sagittal t1 mri of brain without contrast shows area of hyperintensity within the sella and suprasellar regions (red arrow). this likely represents pituitary apoplexy within the known macroadenoma.,,,,,
,,,,,,,mri of the abdomen. fluid - filled mass (18x12 cm) with internal septa located between the stomach and the pancreas with lateral extension in the hepatorenal space.
,,,"abdominal mri showing the largest cystic lesion (11 x 8.3 x 10 cm), which was exophytic.",,,,
,,"axial t2 brain mri scan revealed infarction in the right temporal lobe, ischemia in the left posterior frontoparietal cortex and basal ganglia.",,,,,
,,10-year-old girl with klippel trenaunay syndrome. (c) sagittal t1 weighted mri of the brain shows the undulated borders of the perisylvian cortex posteriorly representative of polymicrogyria (arrow).,,,,,
,,mri brain plain. arrows show prominence of ventricular system. mild prominences of sylvian fissure and sulcal spaces indicate hemi atrophy,,,,,
,,post-treatment mri. most recent enhanced t1-axial mri of the brain showing an enhancing lesion of the left cerebellopontine angle with a smaller maximum diameter than prior to gamma knife treatment.,,,,,
,,,,,,"mri liver showing t2 hyperintense nodules throughout the liver with delayed enhancement, and large t2 hyperintense lesion in segments vi and vii containing multiple smaller lesions with delayed enhancement.",
,,,,,axial t1 weighted contrast enhanced mri image demonstrating ring-enhanced lesion of the left temporal lobe,,
,,axial contrast enhanced t1w mri of brain of 52-year-old male shows left frontal parenchymal arteriovenous malformation associated with large ipsilateral temporo-parietal bleed. the avm nidus is seen as multiple intensely enhancing round and serpentine lesions with enlarged subependymal and superficial cortical draining veins. the arterial feeders were from left middle cerebral artery,,,,,
,,,mri at 21 weeks of gestation. arrows show location of intra-abdominal bleeding.,,,,
,,,,,"the mri scan shows the presence of a tumor in the posterior part of the right frontal lobe. the tumor absorbs the contrast medium, in its interior it can be seen an area of necrosis,and it is surrounded by cerebral edema.",,
,,,,,"magnetic resonance imaging (mri) of a patient with recurrent glioblastoma multiforme (gbm) in the right temporal lobe. (a), external; (b), profound; and (c), intermediary (as in according to the tumor’s center) area of the gbm.",,
,,,,,,,mri abdomen demonstrating increased t2 signal intensities along the left bile ducts and to lesser extent the right bile ducts.
,,,,"angio-mri (coronal section) of the supra-aortic vessels after injection of 20 cc of gadolinium in a woman aged 24 with eds type iv, revealing a dissecting haematoma of the left internal carotid (black arrow), a bilateral dissection of the vertebral arteries in their v1 and v2 segments (white arrows) and a dissection of the middle and distal third of the right subclavian artery (head of arrow).",,,
,,,,"diffusion mri scan at 27 days after the endovascular treatment. the patient's hemiparesis was aggravated, so we rechecked diffusion mri again. in follow-up mri, acute ischemic stroke was found in the territory of the left acha. mri = magnetic resonance imaging; acha = anterior choroidal artery.",,,
,,brain magnetic resonance imaging (mri) in b1000 diffusion sequence showed a restriction of diffusion in the damage areas of the white matter.,,,,,
,,precraniotomy mri t2wi showing the isodense lesion with brain fungus. the brain parenchyma is normal. there is a thin layer of csf between the brain and the lesion,,,,,
,,,abdominal mri at 23‐weeks' gestation identified multiple t2 hyperintense and t1 hypointense lesions in the liver.,,,,
,,,,,,,"mri of abdomen showing lipoatrophic and lipohypertrophic areas in case 2. red arrow, lipoatrophy; blue arrow, lipohypertrophy."
,,patient 3 mri brain t1wi + contrast upon admission,,,,,
,,subcortical vascular dementia type of vascular dementia on fluid attenuated inversion recovery (flair) brain mri.,,,,,
,,,,,,a 75-year-old man with pseudo liver capsular retraction. coronal t2w tse not fat-suppressed mri in this patient followed for colonic adenocarcinoma shows pseudo retraction adjacent to ribs (arrow) and diaphragm (arrowhead).,
postoperative chest wall mri.,,,,,,,
,,,,,"single parenchymal cysticerci in right parietal lobe (mri fast imaging employing steady-state acquisition, fiesta).",,
,,"parasaggital slice in a veterinary epilepsy-specific protocol for 1.5 t mri scanner. t2w parasagittal image of the brain demonstrating a planned sequence parallel (yellow dotted line) and perpendicular (red solid line) to the long axis of the hippocampus. images obtained in a 1.5 t mri (siemens symphony, erlangen, germany)",,,,,
,,,,,mri head – encephalomalacia of left frontal lobe.,,
,,posttreatment axial mri image of the pons with complete ablation of the pontine metastasis and no further visible disease within the brainstem.,,,,,
,,mri brain axial view post-gadolinium contrast images showing multiple cysts of neurocysticercosis in varying stages of development,,,,,
,,mri brain post-contrast showing a heterogeneously enhancing space occupying lesion in the lateral ventricles with extension into the foramen of monro with obstructive hydrocephalus,,,,,
,,,,,coronal mri showing an abscess in the caudate lobe of the liver causing extrinsic compression of the intrahepatic part of the inferior vena cava.,,
,,,,,,,mri abdomen and pelvis t2 weighted sequence coronal view demonstrating well-defined heterogeneous mass within the perineum.
,,"mri brain, axial view, showing t2 hyperintensity in the left thalamus that is extending into the corona radiata",,,,,
,,,mri with gadolinium prior to initial surgical explorationa posterolateral gallbladder mass extending to the abdominal wall muscle and liver.,,,,
,,,abdominal mri showing multiple hepatic nodules,,,,
,,,"abdominal mri, the left renal mass is evident.",,,,
,,brain mri showing multiple infratentorial lesions.,,,,,
,,mid-sagittal t1 weighted mri of the brain shows tonsillar herniation to the level of c3. there is effacement of the fourth ventricle and triventricular hydrocephalus.,,,,,
,,,,bilateral carotid vasculitis. angio-mri showing straight stenosis of the left carotid artery and inflammatory aspect of the right carotid artery (white arrows).,,,
,,brain magnetic resonance imaging (mri) after gadolinium injection showed a non enhancing hypo-intensity image in (t1- sequence) beyond the white matter.,,,,,
,,repeat axial brain mri scan at 1 month.,,,,,
,,brain mri. coronal section (t1) at initial presentation. the arrow is pointing to right sov thrombosis.,,,,,
,,,abdominal mri reveals a cystic lesion measured 4 × 2 cm in mid portion of pancreas.,,,,
,,mri brain t2w axial image showing empty sella and flattening of posterior aspect of globe.,,,,,
,,,,,,,mri of abdomen with contrast showing an irregular slightly contrast enhancing lobulated mass projecting off the anterior mid-portion of the right kidney.
,,,,,,"mri of the liver. september 2007, indicating multiple metastases.",
,,"magnetic resonance imaging (mri) of the brain revealed the loss of posterior pituitary bright spot, suggesting the diagnosis of central diabetes insipidus.",,,,,
,,"mri brain scan performed mid-treatment. the mri brain scan performed shortly after readmission with acute neurological symptoms, demonstrates a number of ring-enhancing lesions with surrounding oedema which were thought likely to be metastases.",,,,,
,,,,,,,mri of the abdomen showing normal appearance of the left renal pelvis in which high-grade transitional cell tumor was discovered on ureteroscopy.
,,"mri scan of the brain, showing a mass suggestive of metastatic choriocarcinoma, in a 32 year-old patient presenting with headache, speech articulation disorder, and dysphagia.",,,,,
,,two-month-old patient. brain mri coronal flair image shows atrophy of the entire left hemisphere with compensatory ipsilateral midline structure shifting.,,,,,
,,"mri of our patient's brain. mild cortical atrophy with bilateral lacunar ischemic lesions and gliosis in the cerebral white matter, mainly in the semi-oval center and the corona radiata.",,,,,
,,,,,liver mri with hemorrhagic infraction of distal vessels of right lobe of the liver.,,
,,brain mri - increased signal in flair images in the withe matter territories adjacent to the lateral ventricles bodies and subcortical zone,,,,,
