mri and chest,mri and lung,mri and brain,mri and abdominal,mri and artery,mri and lobe,mri and liver,mri and abdomen
,,"mri of the brain reveals lissencephaly. shown is a selected image from an axial t2‐weighted mri scan of the brain performed at 2 months 1 week of age. there is a paucity of cortical sulcation with broad, thickened gyri, and a near‐smooth and thickened appearance of the surface of the cerebral cortex, perhaps with a slight posterior predominance. the brain exhibits the typical “hourglass” configuration of lissencephaly. t2‐weighted scans further reveal a hyperintense, cell‐sparse zone within the cerebral cortex further characteristic of lissencephaly. the corpus callosum is dysplastic.",,,,,
,,,,mri gadolinium enhanced image showing the pa confluence and stump positioned to the left of the dks with lpa origin kinking. na : neo-aorta. s: stump. r: right pulmonary artery. l: left pulmonary artery. da: descending aorta,,,
,,,,the tumor between the parapharyngeal space and the upper pole of right thyroid lobe was narrowing the airway passage and displacing the carotid artery and the internal jugular vein laterally on mri.,,,
,,"hyperintense depiction of the left temporal lobe and the insula in t2wi sequence of brain mri scan, indicative for hsv encephalitis.",,,,,
,,repeat mri brain after two weeks showing complete resolution,,,,,
,,,,,mri flair sequence showing hyperintense signals in the left frontal and occipital lobes.,,
,,"mri-flair axial study of the brain (patient #1) showing cortical and subcortical spots with a mild mass effect, with major spreading in the cerebellum (right hemisphere > left hemisphere).",,,,,
,,"flair mri of the brain following resection. the meningioma was clearly resected, which resolved brain compression.",,,,,
,,mri of the brain demonstrating punctate areas of intraparenchymal hemorrhage.,,,,,
,,,"abdominal mri, the left renal mass is evident.",,,,
,,"mri of the brain, 6 weeks after embolectomy, showing stable disease.",,,,,
,,brain mri with and without contrast showing bihemispheric subdural hematomas.,,,,,
,,brain mri showing multiple gadolinium-enhancing lesions (arrows).,,,,,
,,"axial flair mri demonstrating bilateral occipital lobe hyperintensity, suggestive of blood or edema. because the images from other brain mri sequences were normal, the patient was diagnosed with pres.",,,,,
,,mri brain axial section showing putamen necrosis,,,,,
,,,,"axial 3d time of flight mri of the head, noting absence of the carotid canal and internal carotid artery at the skull base (oval). for comparison, note the right-sided internal carotid artery (arrow) at the skull base.",,,
,,,,t2 magnetic resonance imaging (mri) demonstrating flow void in the distal left vertebral artery (arrow) concerning for vertebral artery dissection.,,,
,,magnetic resonance imaging (mri) brain with and without contrast: increased t2 enhancement of the c3 vertebral body concerning for osteomyelitis.,,,,,
,,"mri brain demonstrating mild dilatation of the dominant right transverse sinus, compatible with intracranial hypotension.",,,,,
,,mri brain t 1 axial cut. arrow pointing to periventricular heterotopia. it also shows resection cavity in the right temporal lobe.,,,,,
,,"mri of brain t1 axial + gadolinium with resolution of previously visualized enhancing lesion, after anti-tb treatment.",,,,,
,,,,,,,"zystic-solid teratoma in the left abdomen (case 2; mri, t1, coronal)."
,,,,coronal magnetic resonance imaging (mri) of the left leg reveals the pseudoaneurysm of the posterior tibial artery.,,,
,,,,,,,mri study of the abdomen revealed bilateral hydronephrosis due to severe stenosis of both right and left ureters at the pelvic-ureteral junction level (arrows).
,,mri angiogram shows faint vascularity of left half of brain. the left external carotid and is enlarged and long giving supply to facial haemangioma (black arrows).,,,,,
,,"mri of brain with contrast demonstrating fluid and enhancement within the mastoids, more extensive on the left, suggestive of mastoiditis.",,,,,
,,"brain mri, axial view with contrast enhancementa large temporal lobe mass bridging the skull base into the left pterygomaxillary region.",,,,,
,,"on brain mri (t1, t2), the space-occupying lesion is evident in the left occipital lobe.",,,,,
chest mri (coronal t1 gradient echo sequence with intravenous gadolinium contrast enhancement) in a 50-year-old male patient with castleman disease. the left paraspinal pleural-based mass demonstrates homogenous enhancement following intravenous gadolinium administration (arrow).,,,,,,,
,,"mri brain: increased symmetric t2/flair signal in medial temporal, hippocampi, medial thalamus, and insular regions",,,,,
,,brain mri showing left parietal lobe metastatic lesion.,,,,,
,,"flair-weighted images of the brain mri study, showing bilateral symmetrical regions of hyperintensity in the pulvinar and the dorsomedial nuclei of the thalami (“hockey stick sign”)",,,,,
,,mri brain with arrow showing left cortical dysplasia.,,,,,
,,cranial mri revealed a lacunar infarction localized in the left midbrain (arrow) appearing hyperintense in t2 sections.,,,,,
,,"brain magnetic resonance imaging (mri) on the second day following the burn injury. in the diffusion-weighted mri, multifocal scattered high-signal intensity was seen in both frontoparietal subcortical regions (yellow arrow). it was more distinct on the right side.",,,,,
,,contrast sagittal mri shows well-defined heterogeneously enhancing t1 hypo and t2 hyperintense mass in the right cerebellopontine angle causing mild mass effect on the brain stem (white arrow).,,,,,
,,t1 sag sella (mri brain with and without contrast). red arrow indicating large pituitary mass.,,,,,
,,,,,,,mri scan transverse section abdomen
,,mri brain diffusion sequence showing hyperintensity in the splenium of corpus callosum (black arrow),,,,,
,,"brain mri in axial plane and t2 sequences: extraaxial lesion at the right cerebellopontine angle, heterogeneous, hyperintense with edges well defined. the lesion produces imprint on the brain stem without signs of infiltration. all these features are suggestive of an epidermoid cyst",,,,,
,,mri brain diffusion scan coronal view. multiple areas of acute ischemia in the right corona radiata centrum semiovale with multiple foci of ischemia in the gray-white matter interface on the right.,,,,,
,,,,,the t2 mri sequences in patient ii-4 showed apparent atrophy of the frontal lobe and cerebellar cortex,,
,,contrast-enhanced mri brain seven months after initiation of treatment showing decreased exudates around the optochiasmatic region (arrow),,,,,
,,"brain mri demonstrating the measured dimensions.a, frontal pole of the brain; b, occipital pole of the brain; e, geno of the corpus callosum; z, splenium of the corpus callosum",,,,,
,,brain mri showing multiple periventricular lesions.,,,,,
,,mri brain flair sequence showing hyperintensity in the splenium of corpus callosum (black arrow),,,,,
,,brain magnetic resonance imaging (mri) scan showing a 2×1.6 cm mass with an irregular margin and a high signal intensity in the base of the right cerebellum (black arrow).,,,,,
,,mri t2 axial of the brain on initial presentation.,,,,,
,,,,,coronal view of follow-up mri 10 years after radiotherapy (patient 1). focal enhancement at the base of the frontal lobe was observed. this finding disappeared in follow-up mri after 9 months.,,
,,sagittal section of mri of the brain (t2 weighted) demonstrates hyperintense signal in the right frontotemporal white matter.,,,,,
,,,,,,"model of lumbar subarachnoid injection of human neurons near the human spinal cord. mri image of the human spinal cord (a) with a lumbar puncture of the subarachnoid space adjacent to the cord (b), and injection of cells, such as the gabaergic human neuronal hnt2.17 cells (c) for pain relief, as delivered by syringe (d). a similar technique has been used in all pre-clinical animal experiments and clinical studies with human chromaffin cell injections for pain.",
,,manganese deposits in cns structures. coronal mri t1 image showing hyperintensity signal in the midbrain as consequence of manganese deposition,,,,,
,,,,,"axial t2 weighted mri reveals a bi-lobed disc herniation (arrow), with secondary spinal canal encroachment and mass effect on the cervical spinal cord at the c6-7 level.",,
,,mri of brain with sagittal view demonstrating expansile lesion centered in sphenoid sinus. the area with the signal void represents fungal debris. there is noticeable mass effect upon the sella with superior deviation of the pituitary gland and kinking of the infundibulum.,,,,,
,,,abdominal mri showing a 2 × 2 × 1.8 cm exophytic lesion in the lower pole of the left kidney demonstrating septation and enhancement,,,,
,,,,,t1-weighed mri of the abdomen. 4.2 × 4.7 cm liver metastasis in the anterior left lobe (arrow).,,
,,axial t2w mri of the brain shows symmetric areas of hyperintensity involving the dentate nuclei (arrow) and dorsal pons (arrowhead),,,,,
,,mri brain (t1) showing absent bright spot of posterior pituitary (small arrow) and brainstem atrophy (big arrow),,,,,
,,"prenatal mri evaluates the fetus and pregnancy structures. mr imaging using balanced steady state free precession sequence (b-ffe) of a gravid uterus shows well a 29 weeks old fetus and pregnancy structures: umbilical cord (black arrow), placenta (short white arrow), and amniotic sac (long white arrow). prenatal mri is evaluated in a system-oriented approach that includes the fetus brain, spine, face, neck, thorax, abdomen, pelvis, and extremities as well as the pregnancy structures.",,,,,
,,mri of the brain shows non-enhancing mixed intensities haemorrhagic and cystic areas in the pituitary gland.,,,,,
,,"mri coronal section passing through the interpeduncular fosae. the boundaries of the three areas needed for calculating the medial temporal atrophy index (mtai) and derived methods have been drawn in three different colors: (1) the medial temporal lobe region (a, red), defined in a coronal brain slide as the space bordered in its inferior side by the tentorium cerebelli, in its medial side by the cerebral peduncles, in its upper side by the roof of the temporal horn of the lateral ventricle and in its lateral side by the colateral sulcus and a straight-line linking the colateral sulcus with the lateral edge of the temporal horn of the lateral ventricle; (2) the parenchima within the medial temporal region, that includes the hippocampus and the parahippocampal girus (b, blue); and (3) the body of the ipsilateral lateral ventricle (c, green).",,,,,
,,,mri abdominal showing hypernephroma of the left kidney.,,,,
,,,abdominal mri scan. abdominal mri scan showing the tumor at segment iv of the liver.,,,,
,,a contrast-enhanced mri study of the brain shows a mass in a the right insular cortex with a main diameter of 2 cm in the subcortex of the right insula and no post-contrast enhancement.,,,,,
,,,,,,,"mri of abdomen, axial opposed–phase t1–weighted mr image (tr/te, 308/3.3) shows 9 cm mass in upper pole of right kidney. india ink artifact (arrows) is present at interface of renal mass with kidney. most amls contain macroscopic fat, the india ink artifact appears at all interfaces of the tumor with the kidney or at the interfaces of the fatty and nonfatty portions of the mass. other renal masses do not contain macroscopic fat; for that reason, the india ink artifact appears at the interface of the renal mass with perinephric fat when the mass is exophytic. thus, the diagnosis of aml is indicated when the india ink artifact is present at a renal mass–kidney interface or within a renal mass."
,,eight year-old girl who presented with bilateral breast enlargement. t2wi sagittal mri of the brain shows suprasellar arachnoid cyst (arrows) with hydrocephalus.,,,,,
,,"magnetic resonance imaging (mri) of the brain without ischemic changes, metastatic lesions, or abnormal enhancement with gadolinium.",,,,,
,,,,"pulsation artifact. a 31 year old male with right knee pain. axial t1w mri image shows a low signal rounded focus (arrow) in fibula, which is caused by pulsation artifact from popliteal artery (arrowhead) and mimics a tumor",,,
,,mri of the brain revealed prominent bilateral enhancing parietal-occipital lesions on flair and t2 sequences and small areas of hyperintensity in the left periventricular white matter on diffusion-weighted images.,,,,,
,,diffusion mri brain without contrast showing extensive infarctions within both cerebral hemispheres (see arrows).,,,,,
"chest wall tuberculosis. axial, contrast-enhanced, fatsuppressed, t1w mri shows a pleural-based mass along the dorsal aspect of the right thoracic wall, with irregular peripheral enhancement. note the hazy contours of the adjacent rib (arrow) due to osteomyelitis",,,,,,,
,,"fourth ventricular ependymoma on t1w axial mri brain of a 10 year old brother, whose 13 year old sister figure 7 has right diencphalic oligodendroglioma",,,,,
,,,"coronal gradient echo mri showing atresia of ivc between renal and hepatic segments (sequential white arrows) with a patent hepatic and suprahepatic ivc (psc). extensive, well developed collateralisation through ascending lumbar veins, azygous system and anterior abdominal wall subcutaneous veins (lc).",,,,
,,,,mri scan of the right wrist showing a ganglion cyst (gc) in the region of the ulnar artery and nerve (ua/un) medial to the right carpal tunnel (ct) and hook of hamate (hh).,,,
,,mri of the brain showing the diffuse vwm changes.,,,,,
,,,,,,,"mri of abdomen, axial t2–weighted mr image (tr/te, 4,3/2.2) shows 9 cm mass in upper pole of right kidney. the different signal of tumor and signs of bleeding product and smooth muscle/fat."
,,,,,,ct and mri preoperative imagesaxial mri - attachment to left liver (arrow),
,,,abdominal mri showing bilateral psoas muscle abscesses (arrows).,,,,
,,normal t2 weighted saggital mri brain in 2006,,,,,
,,,"magnetic resonance imaging (mri) revealing the location and morphology of the tumor and the adjacent structures. the abdominal aorta was crushed to left and the inferior vena cava was narrowed. the ascending lumbar, azygos and hemiazygos veins were distended and twisted markedly.",,,,
,,t2 post-contrast coronal mri image of brain showing extension superiorly into the sella and posteriorly into the prepontine cistern with soft tissue prominence of right cavernous sinus with associated encasement of the right internal carotid artery.,,,,,
balanced gradient mri coronal image of the chest and upper abdomen shows hyperintense nodular lesions in the cardiac muscles (arrows) and pancreas (arrowhead),,,,,,,
,,mri brain scan after 10 months of follow-up.,,,,,
"chest mri showed a cystic mass with multiple septa and calcification in apex of heart with bulging in pericardia and local thickening of pericardium due to very late lesion (coronal view) (source: shahid rajaie hospital mri center, tehran, iran)",,,,,,,
,,,,,72-year-old woman with clear-cell meningioma. axial t2 mri. csf cleft surrounding the mass confirms the extra-axial location of the disease (straight arrow). note vasogenic edema within the right temporal lobe (curved arrow).,,
,,,,,mri revealed acute/subacute infarcts in the right cerebellum and left frontal lobe,,
,,,,,,t1 weighted mri (axial view): liver lesion consistent with focal nodular hyperplasia (arrow).,
"chest radiograph demonstrating an aicd in situ. a limited number of aicds are mr-conditional, such as the medtronic evera™ mri icd and biotronik promri® aicd",,,,,,,
,,,,,,,mri abdomen and pelvis t2 weighted sequence sagittal view showing a predominantly cystic mass with scattered solid components within perineum.
,,t1 weighted mri scan showing right sided herniation of brain contents through the orbital bony structural abnormality with proptosis of the globe.,,,,,
,,sagittal t2w mri of the skull shows a basal occipital meningoencephalocele with protrusion toward the naso- and oropharynx. the content of this malformation was primarily fluid with a small quantity of impacted bulb brain parenchyma.,,,,,
,,mri of brain flair sequence showing hyperintensity of splenium of corpus callosum (the boomerang sign),,,,,
,,mri brain (t2 flair) showing high intensity signal lesions within subcortical white matter and single larger lesion in left parietal region,,,,,
,,diffusion-weighted axial mri brain image showing the hyperintense,,,,,
,,,,,,mri showing cranial lesion of undifferentiated embryonal sarcoma of the livermri: magnetic resonance imagingthe cranial lesion of undifferentiated embryonal sarcoma of the liver has been highlighted by the arrows.,
,,axial t2 image of mri brain,,,,,
,,mri brain showed nonspecific ischemic changes.,,,,,
,,,,,,magnetic resonance imaging (mri) showing hepatosplenomegaly with multiple hemangiomas in spleen and liver (arrows),
,,mri brain showing cerebellar atrophy.,,,,,
,,mri brain showing bilateral enlargement (arrows) of the lacrimal glands.,,,,,
,,"mri brain showed a well-defined, lobulated, intra-axial mass lesion in the left frontal lobe. on post contrast study, the lesion showed thick peripheral enhancement with perilesional edema and mass effect on the underlying left lateral ventricle",,,,,
,,mri of the brain with gadolinium: sagittal t1w section showing both extra and intracranial components of the mass. 135×135 mm (300×300 dpi).,,,,,
,,recurrent hemangioblastoma after initial resectionmri of the brain with contrast revealing a hemangioblastoma at the cervicomedullary junction.,,,,,
,,mri-flair axial study of the brain (patient #3) showing multiple cortical and subcortical spots involving both occipital hemispheres.,,,,,
,,,,,,,mri scan of the abdomen focussing on the lesion.
,,,,"angio-mri, tof. aneurysm at the bifurcation of of the right middle cerebral artery in an adpkd patient.",,,
,,,,preoperative contrast mri showing the mass (arrow) in its subpectoral and infraclavicular extension with clear dislocation of axillary and subclavian artery and vein.,,,
,,,abdominal mri of patient b demonstrating an air-fluid level (arrow) of the descending colon with surrounding mass.,,,,
,"antenatal mri of case 1 showing dilated airways (arrow), hyperxpanded lungs, inverted diaphragm, and ascites.",,,,,,
,,,"abdominal mri: hypersignal mass developed at the expense of the rectus abdominis with a contact with the psoas muscle, the sigmoid colon and the external iliac pedicle",,,,
,,,,occlusion from origin of left middle cerebral artery on mri angiography.,,,
,,brain mri of second patient at the age of 18 months (t2 weighted sequences tr/te 4510/119). note the increased signal in the periventicular white matter around the occipital horns of the lateral ventricles with enlargement of both lateral ventricles and the subarachnoid spaces.,,,,,
mri showing image revealing left posterior chest wall lesion.,,,,,,,
,,mri of the brain in sagittal section showing hyperintensities at the cervicomedullary junction (white arrow).,,,,,
,,the brain mri in t2 flair showed the resolution of the central pontine lesions.,,,,,
,,mri of the brain with contrast showing widespread leptomeningeal enhancement (arrows) raising suspicion for leptomeningeal carcinomatosis.,,,,,
,,preoperative brain mri scan showing a hematoma in the left temporo-parietal region and two enhancing nodular lesions in the right frontal and left temporal regions.,,,,,
,,"brain mri, sagittal view without contrast enhancementa large temporal lobe mass bridging the skull base into the left pterygomaxillary region.",,,,,
,,,,,,,"mri abdomen pelvis, t2 axial image, important pelvic cavity invasion with vesicular like lesions, englobing the uterus, the left iliac region with involvement of the posterior fascia of the left rectus abdominis muscle.."
,,mri brain axial section flair image showing bilateral parietoccipital hyperintense signals,,,,,
,,brain mri with and without contrast. the arrow indicates an area of vague enhancement on the surface of the brainstem associated with the left-sided t2 signal abnormality.,,,,,
,,magentic resonance imaging (mri) brain (sagittal section) showing empty sella turcica,,,,,
,,a repeat mri brain showing complete resolution of the signal abnormality in the left cerebellar hemisphere.,,,,,
,,brain mri: coronal t2‐weighted sequence showing absence of olfactory bulbs and tracts.,,,,,
,,mri of the brain showing multiple bilateral infarcts (white arrows).,,,,,
,,six-week follow-up mri brain (flair) showing improvement in bilateral hyperintense lesions.,,,,,
,,mri brain (gre t2wi) showing multiple hypointense lesions diagnosed as cerebral cavernomas.,,,,,
,,mri brain t2 image demonstrating a symmetric hyperintense lesion in the central pons.,,,,,
,,"brain mri, sagittal view without contrast enhancement",,,,,
,,the mri study of the brain revealed prominent bilateral extra-axial c.s.f. spaces with gliosis in both posterior parieto-occipital area with prominent left lateral ventricle and cerebellar folias.,,,,,
,,,,,,mri liver showing a central large heterogenous mass inseparable and encasing the main portal vein and biliary ductal confluence suggestive of cholangiocarcinoma,
,,,,,mri flair shows anterior temporal lobe involement,,
,,"mri brain with gadolinium, axial view, showing well-defined lesion in left lateral part of fourth ventricle with brilliant enhancement",,,,,
,,,,,"hepatobiliary phase of gd-eob-dtpa-enhanced mri. the signal intensities were measured by placing the largest possible regions of interest (rois) on the liver parenchyma, spleen, and erector spinae muscle, avoiding vessels, tumors, and artifacts. for the liver parenchyma, two round or oval rois were placed: one in the right lobe and the other in the left.",,
,,"mri brain, axial view",,,,,
,,brain mri t1 sagittal sequence after gadolinium injection showing homogeneous wall enhancement,,,,,
,,"brain mri, axial view with contrast enhancementperipheral enhancement of the left temporal lobe operative bed and associated vasogenic edema consistent with residual or recurrent neoplastic change.",,,,,
,,t2 mri of the brain after three weeks of inpatient toxoplasmosis treatment; nine weeks after initial presentation.,,,,,
"chest radiograph showed a possible mediastinal mass in a 2-year-old child who was otherwise well. a non-contrast ct study is uninterpretable as there is no mediastinal fat present, unlike in adult patients, to outline the normal mediastinal structures. a contrast-enhanced study is thus mandatory to define the vascular anatomy in a child, and a non-contrast study is of no benefit. the abnormality on the radiograph was a normal thymus, confirmed with ultrasound. (mri would have been a better cross-sectional examination than ct in this context).",,,,,,,
,,"magnetic resonance imaging (mri) of the brain.the arrow in the scan depicts a non-enhancing lesion in the left temporal lobe of the brain, which reflects either a low-grade primary brain malignancy or a metastatic disease.",,,,,
,,,"pelvi-abdominal mri showing a large, well-defined, oval mass measuring 12 × 8 cm in dimensions overlapping the right side of the pelvic cavity (red arrow). the mass appears to be connected to the uterus (blue arrow). a subserosal leiomyoma is suggested. however, a desmoid tumor needs to be excluded.",,,,
,,,,,,visceral situs inversus seen on cardiac mri. axial cut at the level of the left-sided liver and right-sided spleen and stomach. the aorta (ao) is on the right while the inferior vena cava (ivc) is on the left.,
,,mri brain scan tbl2 images showing areas of high intensities in the grey and white matter of the left cerebellar hemisphere suggestive of acute disseminated encephalomyelitis (adem).,,,,,
,,mri scan of brain showing pontine and extrapontine myelinolysis,,,,,
,,,,,mri showing a ring-enhanced mass with mild edema in the right frontal lobe.,,
mri with contrast that confirmed huge soft tissue mass of right side chest and neck,,,,,,,
,,,,,,,mri of the abdomen and pelvis - no signs of recurence of the underlying disease
,,axial flair mri of the brain showing periventricular hyperintense areas in a patient with chronic hcv infection and cognitive changes.,,,,,
,,mri brain with gadolinium: coronal view showing the same falcine meningioma,,,,,
,,,,mri showing compression (arrow) of the right subclavian artery.,,,
,,"24 measurements used to map the hindbrain and craniocervical junction on t1w mid-sagittal mris of a ckcs without sm.key. (a) dorsum of spheno-occipital synchondrosis. (b) basion of basioccipital bone. (c) rostral edge of the dorsal lamina of the atlas. (d) junction between the supraoccipital bone and the occipital crest. (e) most dorsal point of intersection of the cerebellum with the occipital lobe circle. (f) centre of occipital lobe circle placed on the baseline at the level of the basioccipital bone (ab) and extending to encompass the occipital lobes. diameter of circle = f-diam. (g) point at which the optic nerve deviates into the optic canal. (h) rostral edge of supra-occipital bone. (i) intersection point with ventrally extended line dc with the caudally extended ab baseline (forms angle 3 dib). (j) most rostral aspect of the dens of the axis bone. (k) extended line from point b along the best fit line of the ventral medulla oblongata to where it changes angle to the spinal cord. (l) rostral extension of baseline abi (hence becoming baseline labi). 11 angles measured are (1) lae, (2) fac, (3) dib, (4) fae (5) aeb (6) abd (7) bdi (8) ebd (9) jcb (10) afg (11) dbk. * significant for cm in the griffon bruxellois [24].",,,,,
"chest mri showed a cystic mass with multiple septa and calcification in apex of heart with bulging in pericardia and local thickening of pericardium due to very late lesion (horizontal view) (source: shahid rajaie hospital mri center, tehran, iran)",,,,,,,
