mri and chest,mri and lung,mri and brain,mri and abdominal,mri and artery,mri and lobe,mri and liver,mri and abdomen
,,t2 weighted image of mri brain showing multiple metastatic lesions,,,,,
,,mri brain (t2 weighted) showing hyper intensities in bilateral basal ganglia,,,,,
,,,abdominal mri shows gda aneurysm with contrast in the duodenum.,,,,
,,,"abdominal mri, coronal view, on day five of life showing low signal intensity of the liver parenchyma with preservation of the signal intensity of splenic parenchyma (t2wi protocol). calculations of t2∗ showed rapid decay consistent with iron overload.",,,,
,,,abdominal fat area (masked in yellow) was measured from t1 weighted transverse abdominal mri at the level of umbilicus using segmentation technique. l = lumbar vertebral body; p = psoas muscle; sf = subcutaneous fat; u = umbilicus; w = abdominal wall muscles.,,,,
,,dwi tractography findings. dwi tractography seeded from coordinates of maximal activation on fmri to the brainstem (r side of brain appears on l side of image).,,,,,
,,brain mri showing hypointensity of the right fronto-polar region on t2* image,,,,,
,,,,"coronal mri through the left ventricular outflow tract showing normal (solid arrows) and thickened pericardium (open arrow), visible as the black layer in between bright layers of pericardial and epicardial fat.ao=aorta; lv=left ventricle; pa=pulmonary artery; ra=right atrium",,,
,,,,,"axial fluid-attenuated inversion recovery mri image demonstrating tumor-related infiltration involving both temporal lobes (short arrow), and the substantia nigra (long arrow).",,
,,,,,,mri showed dilated extra hepatic bile duct and intrahepatic bile duct in left liver and no finding of anomalous connection with pancreatic duct,
,,,,,coronal mri section revealing a 4.3 × 3.5 cm soft tissue mass at the level of the left thyroid lobe.,,
,,brain mri illustrates a separate circular mass at the top of frontal region with hemorrhage in the right fronto-parietal and left cerebellar hemisphere and air fluid level in right maxillary sinus,,,,,
mri coronal view of the abdomen and the chest. the right kidney appears in a subdiaphragmatic position.,,,,,,,
,,"contrast-enhanced axial section of mri brain showing heterogeneously enhancing soft tissue in ethmoid sinus, orbital apex and causing compression of bilateral optic nerves (arrow)",,,,,
,,a girl with global developmental delay who presented with bilateral breast enlargement. t1wi sagittal mri of the brain (post-gadolinium dynamic protocol) shows an intrasellar lesion representing pituitary microadenoma (arrow).,,,,,
,,"initial mri brain (flair) showing bilateral frontal hyperintense white matter lesions, right > left.",,,,,
,,,,,,mri showing the 9-cm tumour of the right anterior section of the liver with extrahepatic development in patient 3.,
,,"two-hour postoperative brain mri diffusion shows temporo-occipital intracerebral hemorrhage (ich), left posterior temporal ich, right cerebellar subarachnoid hemorrhage (sah), and bilateral frontotemporoparietal sah.",,,,,
,,"mri of the brain: the vascular malformation, in the left occipitotemporal region.",,,,,
,,"mri of the brain showing ring-enhancing lesions, largest measuring up to 3.4 × 1.9 cm in the left superior frontal lobe",,,,,
,,,,,,"hepatosplenomegaly and liver steatosis on mri scan of an adult patient diagnosed with cholesterol ester storage disease.abbreviation: mri, magnetic resonance imaging.",
,,,,diffusion weighted mri showing increased signal in a superior division middle cerebral artery branch territory.,,,
,,,"coronal t2 abdominal mri demonstrating multiple, large, multi-loculated cystic hepatic masses and significant hepatomegaly.",,,,
,,,,,t1 lava flex breath hold magnetic resonance imaging (axial)t1 lava flex breath hold magnetic resonance imaging (mri) of abdomen axial view demonstrates diffuse t1 hypointense signal through the right hepatic lobe with central areas of t1 hyperintensity (arrow). these findings represent central necrosis and hemorrhage.,,
,,stroke in a patient affected with fabry disease: axial brain mri section showing stroke of the left cerebellar hemisphere that revealed fabry disease in an otherwise asymptomatic 27-year-old male patient.,,,,,
,,brain mri. axial section (t2) at initial presentation. the arrow is pointing to decreased signal within right superior ophthalmic vein thrombosis.,,,,,
,,,,,mri abdomen: lipomatous tissue anterior to the liver and between the right lobe of the liver and the right kidney.,,
,,,,,,mri of abdomen showing large space occupying lesions in liver,
,,,,,"hyperintense radial bands (black arrow) extending linearly at the level of the right cerebral hemisphere and a cortical tuber (short white arrow) located at the left parietal lobe in an axial flair mr image in a case with tuberous sclerosis complex. in addition, mri showing a subependymal nodule (thin black arrow).",,
,,postoperative sagittal t1 mri of brain without contrast shows resolution of the prior areas of hyperintensity within the sella turcica (red arrow). the pituitary stalk is now visible (yellow arrow).,,,,,
,,"subsequent magnetic resonance imaging (mri), however, showed massive brain stem infarction",,,,,
,,saggital mri brain with a glioblastoma multiforme in a male farm worker,,,,,
,,mri brain of patient 2 showing atrophy of cerebellum.,,,,,
,,diffusion-weighted imaging (dwi) mri of the brain showing an acute svi involving the right thalamus (a) and an older svi involving the left internal capsule (b).,,,,,
,,fluid attenuation inversion recovery mri image of the brain demonstrating focal high signal in the posterior left parietal lobe in the same location as the ring enhancing metastasis in fig. 2.,,,,,
,,,abdominal mri imaging. multiple nodular lesions in the liver were demonstrated by fat-suppression mri.,,,,
,,,,,axial t1-wi mri demonstrating mass effect and infiltration to the temporal lobe with vasogenic edema.,,
,,flair mri brain showing high signal abnormality in the floor of the fourth ventricle.,,,,,
,,mri brain showing lesion in right cerebellum suggestive of haemorrhage or an abscess.,,,,,
,,brain mri showing cerebral and cerebellar atrophy.,,,,,
,,,,,,,mri of abdomen without contrastmri showing obstruction of the distal colon with dilation of the upstream colon and retained feces. gravid uterus is partially seen.
,"mri appearance of normal fetal kidneys. sagittal t2-ssfse of a fetal abdomen at 25 wg: note the size and the signal appearance of the normal kidney between the two arrowheads. the fluid-filled urinary bladder (white arrow), the adequate volume of the amniotic fluid, and the developing lungs (black arrow) indicate good renal function. note that the urinary bladder can occupy a considerable portion of the abdomen as a normal finding.",,,,,,
,,pretreatment brain mri.,,,,,
,,sagittal t2 magnetic resonance imaging (mri) of the brain (05/01/2015),,,,,
,,coronal fluid attenuation inversion recovery (flair) mri showing gray area of high signal in posterior brain within the cortical area and subcortical white matter of right occipital lobe.,,,,,
,,,,,,,"mri of the abdomen (t1, in phase) showing bilateral adrenal masses (arrows)."
,,axial t2 image of mri brain showing face of giant panda sign typical of wilson's disease,,,,,
,,"brain mri film. multiple sites of cerebral infarction were identified. however, no brain metastasis was observed.",,,,,
,,"increased subgenual anterior cingulate cortex (sgacc) activity to emotional distraction, in women. the area indicated by the white circle (ba 25), showing a difference in activation in response to angry faces in women versus men, was masked with a map identifying a main effect of emotion relative to baseline in women. the bar graph illustrates the fmri signal, as extracted from the region of interest corresponding to the difference in activation between women and men. the activation map is superimposed on a high-resolution brain image displayed in sagittal view (with x indicating the talairach coordinate on the left-right axis of the brain). error bars represent standard errors of means. emo, emotional distracters; neu, neutral distracters; scr, scrambled distracters. reproduced from iordan et al. (2013a), with permission.",,,,,
,,mri of a patient with a past medical history of “uneventful sinus surgery” 7 years ago. patient suffers from intercurrent meningitis. image shows residual findings of a skull base laceration (loco typico) with residual signs of trauma of the neighbouring brain tissue.,,,,,
,,"the pre-treatment brain mri check-up demonstrated cels. the main locations are supra- and infratentorial white matter, hemispheric white matter, cortical-subcortical junction, and periventricular white matter bilaterally",,,,,
,,,,,,mri revealing mass in the right anterior sector plus left medial section of the liver with internal cystic component.,
,,,,,,t2 hyperintense liver lesion on mri.,
,"axial short time inversion recovery (stir) mri (tr 5.97, te 60, ti 130 ms) of a patient with hl, showing a large mediastinal mass (long arrow), with direct lung infiltration (arrow heads) and a large pleural effusion (short arrow).",,,,,,
,,mri brain revealing evidence of predominantly right frontal cerebritis with early abscess formation,,,,,
,,,,,mri head axial section showing a mass lesion in the left medial temporal lobe adjacent to the cavernous sinus and oculomotor nerve (arrow).,,
,,mri brain t1 weighted coronal images suggestive of a hyperintense lesion occupying the lateral ventricles and extending into the third ventricle. hydrocephalus also evident,,,,,
,,,,the middle cerebral artery was noted to have recanalized when repeat mri studies were performed at just beyond 6 weeks postpartum.,,,
,,"axial t2 weighted mri scan of patient 4 shows frontotemporal brain atrophy, temporal hypoplasia,",,,,,
,,mri brain of the patient with hashimoto encephalopathy showing normal study during the initial presentation,,,,,
,,,,,"mri of the neck done on the initial presentation showing a 3 cm by 2.3 cm by 2.7 cm left parotid mass, involving the superficial and deep lobes of the left parotid gland.",,
,,brain mri showing a tumor in the clivus and involvement of sphenoid bone,,,,,
,,axial mri of the brain following 3 months of anti-tb therapy demonstrating an important resolution of the previous brain lesions.,,,,,
,,coronal section of brain mri with contrast showing a large lobulated collection in the parieto-occipital region.,,,,,
,,mri brain before treatment showing bright t2/flair cortical images at the right parietal and temporal region,,,,,
,,,t1 mri showing a soft tissue tumour of the anterior abdominal wall involving external oblique and internal oblique and not involving the peritoneum.,,,,
,,"mri brain (sagittal section) showing invasive giant prolactinoma with effacement of sella with predominant suprasellar component extending anteriorly, superiorly and posteriorly",,,,,
,,flair mri brain follow-up showing improvement of the signal abnormality in the fourth ventricle.,,,,,
,,,,,,,"mri of abdomen showing heterogeneous mass extending from the right suprarenal fossa and into the peritoneal cavity, measuring 10.2 cm × 10.5 cm × 8.5 cm (ap × trv × si). there are multiple large collections of high t2 signal consistent with cystic component degeneration."
,,,,,,,coronal mri of the abdomen showing right supra-renal mass (red arrow).
,,the brain mri image of the patient,,,,,
,,,,,,"mri of the liver. september 2007, indicating multiple metastases.",
,,,,,head mri: pathological mass located on the border between anterior and posterior pituitary lobe (8 mm × 7 mm dimension) and thickening of the pituitary stalk to 5 mm,,
,,"brain magnetic resonance imaging (mri) sagittal view showing dilatation of intracranial segment of basilar artery, with extrinsic pressure over both sides of medulla",,,,,
,,axial brain mri t2 sequence.,,,,,
,,"axial mri view of the brain at the age of 17 showing bilateral diffuse symmetric increased flair signal in the subcortical and periventricular white matter with diffuse atrophic changes involving the supratentorial brain. axial flair image performed on a 3t mr ge scanner with tr: 9002, te: 124.7.",,,,,
,,,abdominal mri examination revealed high signal-intensity lesion (arrows) around the surgical scar in t2 weighted images with fat-suppression.,,,,
,,,,"axial cut on mri showing a 7.5 × 7 × 6.5 cm aneurysm in the distal portion of the splenic artery with an intramural thrombus, abutting the splenic hilum.",,,
,,magnetic resonance imaging (mri) brain (t2 flair),,,,,
,,pre operative mri showing large ventral foramen magnum meningioma severely compressing the brainstem,,,,,
,,post-srs mri scanthe latest mri of the brain shows complete resolution and local control of the treated lesions.,,,,,
,,"mri brain with contrast showing near resolution of enhancement, stable on serial mris for 2 years.",,,,,
,,,"follow-up abdominal mri, coronal view, at 8 months showing normal intensity of liver parenchyma on t2wi with fat saturation protocol.",,,,
"chest and abdomen mri showing dilated central small bowel and swirling pattern of these dilated loops—“whirlpool sign” (arrow). mri, magnetic resonance imaging.",,,,,,,
,,coronal t2 weighted mri shows a subdural left sided effusion (asterisk) and diffuse cystic changes of the brain in keeping with multicystic encephalomalacia,,,,,
,,mri brain t2 hyperintensity signal involving cerebellar hemisphere greatest on left.,,,,,
,,,"proband’s abdominal mri. bilateral enlarged adrenal glands, with lobulated contours, heterogeneous nodular structure, the right one with 55 × 54 × 30 mm and the left one with 85 × 53 × 39 mm.",,,,
,,brain mri showed hemorrhagic mass involving the medial aspect of the left cerebellum and crossing the midline to the right hemisphere.,,,,,
,,brain mri. image in t1 shows a right frontal tumor of 19 × 21 × 19 mm with associated edema.,,,,,
,,mri brain showing obliteration of superior saggital sinus,,,,,
,,"brain mri t2, axial sequence, showing a hyperintense cyst image in the vermis. the cyst produces a mass effect on brainstem and 4th ventricle",,,,,
,,,,,,56-year-old man with intrahepatic biliary intraductal oncocytic papillary carcinoma. mri of the liver demonstrates the soft tissue component is of intermediate signal on t1 and hypointense on t2 and has negligible enhancement. note the aneurysmally dilated cystic component communicating with adjacent dilated intrahepatic biliary tree (black arrow),
,,transverse section of mri of the brain (t2 weighted with gadolinium) demonstrates hyperintense signal in the right frontotemporal white matter.,,,,,
,,,abdominal mri imaging scan showing a large dominant mass in the left hepatic lobe along with numerous other smaller hepatic lesions.,,,,
,,,,,,t1 hypointense liver lesion on mri.,
,,,,coronal mri image: ulnar nerve compression in guyon's canal due to tortuous ulnar artery.,,,
,,mri brain t1 flair sequence showing altered signal intensity (arrow) in cisterns around the brainstem,,,,,
,,"a 52 year old woman was investigated for headache and recent onset seizures. her mri of the brain showed three discrete hyperintense lesions in the right frontal, temporal and parietal subcortex which enhanced on contrast. biopsy of the larger lesion revealed dense lymphocytic infilteration with scattered foci of plasma cells, epitheloid cells and langerhan's giant cells and surrounding gliosis. a repeat mri done 3 months after starting anti tuberculous therapy showed resolution of lesions",,,,,
,,the brain mri of the patient with sdb and chiari type i malformation. the white arrow shows herniation of cerebellar tonsils through foramen magnum.,,,,,
,,,,,"axial mri image demonstrating ocular involvement, with abutment of right lateral rectus muscle, as well as enhancement of temporal lobe.",,
,,mri screening of brain showing single focal well-circumscribed hyperintense lesion (arrow) in t2 sequence at right subcortical frontal region (at gray white interface).,,,,,
,,a 1.2-cm ring-enhanced mass with peripheral edema at right thalamus in the gadolinium-enhanced brain mri.,,,,,
,,mri findings at the level of the brain stem. a gadolinium‐enhanced axial flair image shows a diffuse leptomeningeal enhancement around the medulla oblongata (white arrow heads).,,,,,
,,,,"mri showing a thrombosis of the ulnar artery, an inflammation of the ulnar nerve and surrounding tissue at the level of the guyon's canal.",,,
,,,preoperative abdominal mri.,,,,
,,sagittal t2 brain mri demonstrating low-lying cerebellar tonsils with a decrease in the mamillo-pontine distance and draping of the optic chiasm over the dorsum sellae,,,,,
,,mri of the brain showing findings suggestive of advanced amyloid angiopathy.,,,,,
,,patient 1 mri brain t1wi + contrast upon admission,,,,,
,,mri of the brain: t2 flair axial sequence demonstrating a solitary hyperintense lesion at the junction of the right thalamus and the posterior limb of the internal capsule.,,,,,
,,the second and the third postoperative mris present further decompression of lateral ventricle and increase in brain volume,,,,,
,,mri brain – frontal bone defect immediately to the left of midline along with a defect in the adjacent scalp. there is focal encephalomalacia in the left frontal lobe in a parafalcine location.,,,,,
,,"additional morphometric measurements taken of the t2w mid-sagittal brain mri of a ckcs with cm pain.key for identity of points a-l see fig 1. three ‘best fit’ circles (coloured aqua) and an ellipse (coloured red) that follow the outline shape of the neural parenchyma as closely as possible. occipital circle (centre f)–as for hindbrain study. size is determined by the shape of the occipital lobe extending rostroventrally to the baseline labi (basioccipital bone). i forebrain circle (centre m)—most rostral portion of the forebrain dorsal to the cribriform plate of the ethmoid bone. ii olfactory circle (centre n)—size is determined by the shape of olfactory bulbs extending beyond the pre-frontal cortex in the mid-sagittal image. iii cerebral parenchyma ellipse which encompasses the caudal edge of the occipital and rostral edge of the forebrain circle (i.e. the cerebral parenchyma but not including the entire cerebellum or brainstem), its area (mm2) together with its ellipticity ‘e’ (defined as a mathematical relationship between of the largest radius to the smallest radius in the ellipse). both calculated by mimics materialise® software programme. (smaller e values = more spherical, larger e values more elliptical). iv associated lines (coloured aqua) comprising mf, nf, the olfactory bulb (ob) length and height (product represented. v five angles (coloured yellow): • top angle—angulation between the frontal and parietal lobes. • bottom angle -angulation between the dorsal ob and the frontal lobe. • ob angle—angulation between the ob and hard palate. • mfn and nfg.",,,,,
,,,,initial mri showing an enhancing lesion in the right cavernous sinus exerting mass effect and narrowing the cavernous segment of the right internal carotid artery.,,,
,,,,"the axial fat-saturated t1 mri sequence shows dissection of the left (arrow) and dissection of the right va (arrow head).abbreviations: mri, magnetic resonance imaging; va, vertebral artery.",,,
,,figure 1. periventricular heterotopia. coronal t2 mri of the brain demonstrates bilateral heterotopic nodules (arrowheads) of neurons that are ectopically situated along the neuroepithelium of the lateral ventricles.,,,,,
,,mri brain (stir axial) showing bilateral cerebellar infarct,,,,,
,,mri of brain showing large midline anterior calvarial defect at basifrontal and frontonasal region with anteriorly herniated frontal lobe,,,,,
,,axial mri of the brain. diffusion weighted imaging sequence showing acute left globus pallidus infarct.,,,,,
,,mri of the brain with contrast highlighting multiple ring-enhancing lesions.,,,,,
,,axial flair brain mri demonstrating a mass in the left posterior carotid space at the skull base.,,,,,
,,"mri brain with and without contrast revealing multiple foci of predominantly cortical signal change with the largest area involving the medial right cerebellar hemisphere (white arrow). the appearance is most compatible with subacute infarcts, presumably from an embolic source. there are no enhancing masses to suggest metastatic disease.",,,,,
,,mri of brain with gadolinium showing postsurgical changes within the right temporal lobe with no significant mass effect or midline shift (arrow).,,,,,
,,mri of the brain with acute ischemic infarct in the right lobe.,,,,,
,,,,,,,abdomen and pelvic mri scan shows 5.5×3.5 cm high signal intensity mass in the uterine cervix.
,,mri of the brain with contrast. increased flow in the left cavernous sinus and engorgement of the left ophthalmic vein.,,,,,
,,,,,post-operative mri showed a large cerebral haemorrhagic infarction in the right occipital lobe.,,
,,axial image from mri of the brain demonstrating generalized smooth pachymeningeal thickening and enhancement secondary to lymphomatous infiltration.,,,,,
,,posterior cuts of coronal sections of mri brain (dec 2011) showing normal-sized pituitary (solid white arrow) surrounded by cystic fluid (hollow white arrow),,,,,
,,"preoperative mri of the brain showed a left temporal lesion, hypointense on t1, heterointense on t2, with heterogenous enhancement",,,,,
,,mri brain diffusion-weighted sequences “demonstrate restricted diffusion in the posterior parietal lobes and occipital lobes bilaterally. there may be restricted diffusion in the left cerebellar hemisphere. findings consistent with infarcts” per pediatric radiologist. image reviewed by a pediatric neurologist who agreed with the findings.,,,,,
,,"enhanced mri scan shows tuberculous, ring-shaped, signal-intensified lesions in bilateral frontal and parietal lobes, centrum semiovale, peri-lateral ventricular region, basal ganglia regions, thalamus, brainstem and cerebellum.",,,,,
,,,,,"mri of the abdomen showing multiple abscesses in the liver, the largest (7.5×7.2×7.0 cm) of which was in the right lobe.",,
,,,contrast abdominal mri/mrcp showed enlargement of the head and uncinate process portions of the pancreas measuring 5.0 x 4.1 cm (arrow) and a distended gallbladder (arrowhead).,,,,
,,,,"mri imaging of the left ventricle (lv), ascending aorta (aao). the left subclavian artery (lsa) is dilated and the descending aorta (dao) is hypoplastic. the coarctation imposes as atresia. there are numerous collaterals. rv: right ventricle",,,
,,coronal mri scans of brain showing right parasellar mass,,,,,
,,,"case 1: 3-month-old male child presenting with symptoms of pallor, abdominal distension, petechial rashes, and recurrent respiratory infections later diagnosed with congenital leukemia. magnetic resonance imaging (mri) of the pelvis in coronal plane using short tau inversion recovery (stir) sequence, shows increased marrow signal intensities in both iliac bones (r × l) (arrows).",,,,
,,"mri of brain after ventriculoperitoneal shunt placement; single monoventricle with hydrocephalus, partially fused frontal interhemispheric fissure consistent with semilobar hpe.",,,,,
,,axial flair mri brain showing left temporal arachnoid cyst,,,,,
,,mri brain on presentation.,,,,,
,,,,,same patient as figs 13 and 14. coronal t2w mri demonstrating the slightly hypointense olfactory neuroblastoma extending both intraorbitally and intracranially with extensive edema in the right frontal lobe.,,
,,mri of the brain (axial section). mass in the fourth ventricle with minimal paraventricular spread.,,,,,
,,,,,"coronal mri showing multiple liver abscesses, with that in the caudate lobe causing extrinsic compression of the inferior vena cava.",,
,,brain mri: sagittal t1‐weighted sequence showing abnormal posterior fossa with a short squama occipitalis and a short and vertical clivus. cerebellar tonsils protrude below the foramen magnum.,,,,,
,,saggital mri brain with a glioblastoma multiforme in a male farm worker,,,,,
,,normal mri brain with no temporal or leptomeningeal enhancement (t2 flair sequence).,,,,,
,,"non contrast sagittal t1 image. lady in her 30's with new onset headache, reaching maximum within several hours and with almost complete relief on lying flat. symptoms persisted for several weeks before mri imaging performed. shows pituitary engorgement (short arrow), sagging of brain stem with loss of normal pontine convexity (long arrow), and cerebellar tonsillar descent (medium arrow).",,,,,
,,,abdominal mri detected a hepatic metastasis measuring 10 mm in the right lobe of the liver (segment 6) (arrow).,,,,
,,,,,,,mri of abdomen and pelvic cavity showing abnormal changes of bilateral scrotum and multiple enlarged lymph nodes in the left inguinal region.
,,a contrast-enhanced mri study of the brain shows a minimal decrease in the size or extent of the underlying non-enhancing tumor involving the right anterior insular region and possible postopeative or post biopsy tissue defects.,,,,,
,,,"abdominal mri showing an abnormal nodular signal, oval, well limited, measuring 16 mm, raising to the arterial phase in respect to the pancreatic duct and the splenic vein",,,,
,,mri on hospital day 43. the brain metastasis had increased to 20 mm in diameter and the surrounding cerebral edema had become worse.,,,,,
"postmortem axial mri of the chest of an 8-month-old boy who died of unknown causes. unusually, there was apparent sedimentation/layering of blood in the pericardial sac (a) as well as in the left pleural cavity (b), which was attributed to traumatic pericardiocentesis during resuscitation. there was no evidence of trauma",,,,,,,
,,brain mri shows abnormal enhancement of the perineural sheath of the left optic nerve.,,,,,
